{
  "batch_id": "wave8b-c0-sol-f12-r3-depth",
  "catalog_digest": "sha256:e4615beeb71c3e5a03f5175f515cb83d5e56166c9f1240d3eadbb61c0bb9d2d3",
  "created_at": "2026-08-27T17:20:00.000Z",
  "entries": [
    {
      "block_id": "wave8b-c0-sol-f12-r3-depth",
      "case_id": "F12-L-MDJSON-001",
      "effort": "medium",
      "evaluator_timeout_seconds": 120.0,
      "model": "gpt-5.6-sol",
      "order": 1,
      "output_bytes_cap": 8388608,
      "provider": "codex",
      "run_id": "run-001-e2164ef0ca1a2abc",
      "timeout_seconds": 1200.0
    },
    {
      "block_id": "wave8b-c0-sol-f12-r3-depth",
      "case_id": "F12-L-MDJSON-001",
      "effort": "high",
      "evaluator_timeout_seconds": 120.0,
      "model": "gpt-5.6-sol",
      "order": 2,
      "output_bytes_cap": 8388608,
      "provider": "codex",
      "run_id": "run-002-3a2fcb62d6cbf63d",
      "timeout_seconds": 1200.0
    },
    {
      "block_id": "wave8b-c0-sol-f12-r3-depth",
      "case_id": "F12-L-MDJSON-001",
      "effort": "xhigh",
      "evaluator_timeout_seconds": 120.0,
      "model": "gpt-5.6-sol",
      "order": 3,
      "output_bytes_cap": 8388608,
      "provider": "codex",
      "run_id": "run-003-116fc43094c93b43",
      "timeout_seconds": 1200.0
    },
    {
      "block_id": "wave8b-c0-sol-f12-r3-depth",
      "case_id": "F12-L-MDJSON-001",
      "effort": "max",
      "evaluator_timeout_seconds": 120.0,
      "model": "gpt-5.6-sol",
      "order": 4,
      "output_bytes_cap": 8388608,
      "provider": "codex",
      "run_id": "run-004-15df2e9523b3622e",
      "timeout_seconds": 1200.0
    },
    {
      "block_id": "wave8b-c0-sol-f12-r3-depth",
      "case_id": "F12-L-MDJSON-001",
      "effort": "high",
      "evaluator_timeout_seconds": 120.0,
      "model": "gpt-5.6-sol",
      "order": 5,
      "output_bytes_cap": 8388608,
      "provider": "codex",
      "run_id": "run-005-d67977cc75d9322f",
      "timeout_seconds": 1200.0
    },
    {
      "block_id": "wave8b-c0-sol-f12-r3-depth",
      "case_id": "F12-L-MDJSON-001",
      "effort": "xhigh",
      "evaluator_timeout_seconds": 120.0,
      "model": "gpt-5.6-sol",
      "order": 6,
      "output_bytes_cap": 8388608,
      "provider": "codex",
      "run_id": "run-006-d8f8e1d391da1d28",
      "timeout_seconds": 1200.0
    },
    {
      "block_id": "wave8b-c0-sol-f12-r3-depth",
      "case_id": "F12-L-MDJSON-001",
      "effort": "max",
      "evaluator_timeout_seconds": 120.0,
      "model": "gpt-5.6-sol",
      "order": 7,
      "output_bytes_cap": 8388608,
      "provider": "codex",
      "run_id": "run-007-c92d57bc4a3b9e60",
      "timeout_seconds": 1200.0
    },
    {
      "block_id": "wave8b-c0-sol-f12-r3-depth",
      "case_id": "F12-L-MDJSON-001",
      "effort": "medium",
      "evaluator_timeout_seconds": 120.0,
      "model": "gpt-5.6-sol",
      "order": 8,
      "output_bytes_cap": 8388608,
      "provider": "codex",
      "run_id": "run-008-247ccf32bdb93658",
      "timeout_seconds": 1200.0
    }
  ],
  "purpose": "finite explicit C0 observations; repeat=2; rotation-seed=20260828; no routing recommendation or default winner",
  "safety": {
    "artifact_retention": "task-artifacts",
    "automatic_retry": false,
    "concurrency": 1,
    "continue_after_quality_fail": true,
    "deadline_seconds": 14400.0,
    "max_runs": 8
  },
  "schema_version": 1,
  "study_id": "duration-atlas-wave8-identifiable"
}
