{
  "batch_id": "wave8-c0-grok-f12-depth",
  "catalog_digest": "sha256:c3c386e697885b96ce20571628e1923b27498db720afd34605a4931c47a3ff59",
  "created_at": "2026-08-27T16:42:00.397Z",
  "entries": [
    {
      "block_id": "wave8-c0-grok-f12-depth",
      "case_id": "F12-L-MDJSON-001",
      "effort": "high",
      "evaluator_timeout_seconds": 120.0,
      "model": "grok-4.6",
      "order": 1,
      "output_bytes_cap": 8388608,
      "provider": "grok",
      "run_id": "run-001-6d0229ea423b11e6",
      "timeout_seconds": 900.0
    },
    {
      "block_id": "wave8-c0-grok-f12-depth",
      "case_id": "F12-L-MDJSON-001",
      "effort": "xhigh",
      "evaluator_timeout_seconds": 120.0,
      "model": "grok-4.6",
      "order": 2,
      "output_bytes_cap": 8388608,
      "provider": "grok",
      "run_id": "run-002-aa73dd47f70f9744",
      "timeout_seconds": 900.0
    },
    {
      "block_id": "wave8-c0-grok-f12-depth",
      "case_id": "F12-L-MDJSON-001",
      "effort": "medium",
      "evaluator_timeout_seconds": 120.0,
      "model": "grok-4.6",
      "order": 3,
      "output_bytes_cap": 8388608,
      "provider": "grok",
      "run_id": "run-003-c9bfbc4717839747",
      "timeout_seconds": 900.0
    },
    {
      "block_id": "wave8-c0-grok-f12-depth",
      "case_id": "F12-L-MDJSON-001",
      "effort": "xhigh",
      "evaluator_timeout_seconds": 120.0,
      "model": "grok-4.6",
      "order": 4,
      "output_bytes_cap": 8388608,
      "provider": "grok",
      "run_id": "run-004-c5b4fd1f853ad7b2",
      "timeout_seconds": 900.0
    },
    {
      "block_id": "wave8-c0-grok-f12-depth",
      "case_id": "F12-L-MDJSON-001",
      "effort": "medium",
      "evaluator_timeout_seconds": 120.0,
      "model": "grok-4.6",
      "order": 5,
      "output_bytes_cap": 8388608,
      "provider": "grok",
      "run_id": "run-005-987204af35cf4649",
      "timeout_seconds": 900.0
    },
    {
      "block_id": "wave8-c0-grok-f12-depth",
      "case_id": "F12-L-MDJSON-001",
      "effort": "high",
      "evaluator_timeout_seconds": 120.0,
      "model": "grok-4.6",
      "order": 6,
      "output_bytes_cap": 8388608,
      "provider": "grok",
      "run_id": "run-006-7355424bc3116cd0",
      "timeout_seconds": 900.0
    }
  ],
  "purpose": "finite explicit C0 observations; repeat=2; rotation-seed=20260828; no routing recommendation or default winner",
  "safety": {
    "artifact_retention": "task-artifacts",
    "automatic_retry": false,
    "concurrency": 1,
    "continue_after_quality_fail": true,
    "deadline_seconds": 7200.0,
    "max_runs": 6
  },
  "schema_version": 1,
  "study_id": "duration-atlas-wave8-identifiable"
}
