{
  "batch_id": "wave8-c0-sol-f12-depth",
  "catalog_digest": "sha256:c3c386e697885b96ce20571628e1923b27498db720afd34605a4931c47a3ff59",
  "created_at": "2026-08-27T16:42:00.397Z",
  "entries": [
    {
      "block_id": "wave8-c0-sol-f12-depth",
      "case_id": "F12-L-MDJSON-001",
      "effort": "medium",
      "evaluator_timeout_seconds": 120.0,
      "model": "gpt-5.6-sol",
      "order": 1,
      "output_bytes_cap": 8388608,
      "provider": "codex",
      "run_id": "run-001-c0ad9bbd56770bec",
      "timeout_seconds": 1200.0
    },
    {
      "block_id": "wave8-c0-sol-f12-depth",
      "case_id": "F12-L-MDJSON-001",
      "effort": "high",
      "evaluator_timeout_seconds": 120.0,
      "model": "gpt-5.6-sol",
      "order": 2,
      "output_bytes_cap": 8388608,
      "provider": "codex",
      "run_id": "run-002-6b836711c597e8c3",
      "timeout_seconds": 1200.0
    },
    {
      "block_id": "wave8-c0-sol-f12-depth",
      "case_id": "F12-L-MDJSON-001",
      "effort": "xhigh",
      "evaluator_timeout_seconds": 120.0,
      "model": "gpt-5.6-sol",
      "order": 3,
      "output_bytes_cap": 8388608,
      "provider": "codex",
      "run_id": "run-003-4a2ed2e69c93c6c3",
      "timeout_seconds": 1200.0
    },
    {
      "block_id": "wave8-c0-sol-f12-depth",
      "case_id": "F12-L-MDJSON-001",
      "effort": "max",
      "evaluator_timeout_seconds": 120.0,
      "model": "gpt-5.6-sol",
      "order": 4,
      "output_bytes_cap": 8388608,
      "provider": "codex",
      "run_id": "run-004-96e63a304115004b",
      "timeout_seconds": 1200.0
    },
    {
      "block_id": "wave8-c0-sol-f12-depth",
      "case_id": "F12-L-MDJSON-001",
      "effort": "high",
      "evaluator_timeout_seconds": 120.0,
      "model": "gpt-5.6-sol",
      "order": 5,
      "output_bytes_cap": 8388608,
      "provider": "codex",
      "run_id": "run-005-d7152a0e32f13c0a",
      "timeout_seconds": 1200.0
    },
    {
      "block_id": "wave8-c0-sol-f12-depth",
      "case_id": "F12-L-MDJSON-001",
      "effort": "xhigh",
      "evaluator_timeout_seconds": 120.0,
      "model": "gpt-5.6-sol",
      "order": 6,
      "output_bytes_cap": 8388608,
      "provider": "codex",
      "run_id": "run-006-627f0f68af1d59f4",
      "timeout_seconds": 1200.0
    },
    {
      "block_id": "wave8-c0-sol-f12-depth",
      "case_id": "F12-L-MDJSON-001",
      "effort": "max",
      "evaluator_timeout_seconds": 120.0,
      "model": "gpt-5.6-sol",
      "order": 7,
      "output_bytes_cap": 8388608,
      "provider": "codex",
      "run_id": "run-007-bbcc42a98d362554",
      "timeout_seconds": 1200.0
    },
    {
      "block_id": "wave8-c0-sol-f12-depth",
      "case_id": "F12-L-MDJSON-001",
      "effort": "medium",
      "evaluator_timeout_seconds": 120.0,
      "model": "gpt-5.6-sol",
      "order": 8,
      "output_bytes_cap": 8388608,
      "provider": "codex",
      "run_id": "run-008-c3ffda08ade1c66d",
      "timeout_seconds": 1200.0
    }
  ],
  "purpose": "finite explicit C0 observations; repeat=2; rotation-seed=20260828; no routing recommendation or default winner",
  "safety": {
    "artifact_retention": "task-artifacts",
    "automatic_retry": false,
    "concurrency": 1,
    "continue_after_quality_fail": true,
    "deadline_seconds": 14400.0,
    "max_runs": 8
  },
  "schema_version": 1,
  "study_id": "duration-atlas-wave8-identifiable"
}
