{
  "batch_id": "wave5-c0-sol-max-deep4",
  "catalog_digest": "sha256:c89c127d5b02d0e72989508f6a7d7c0b9d1ed828ca61aa616db41ad90cb0f7d0",
  "created_at": "2026-08-27T13:25:00Z",
  "entries": [
    {
      "block_id": "c0-sol-max-deep-coverage",
      "case_id": "F12-L-MDJSON-001",
      "effort": "max",
      "evaluator_timeout_seconds": 300.0,
      "model": "gpt-5.6-sol",
      "order": 1,
      "output_bytes_cap": 1048576,
      "provider": "codex",
      "run_id": "run-001-f2d7073edac558ff",
      "timeout_seconds": 3600.0
    },
    {
      "block_id": "c0-sol-max-deep-coverage",
      "case_id": "F03-L-PYBASH-001",
      "effort": "max",
      "evaluator_timeout_seconds": 300.0,
      "model": "gpt-5.6-sol",
      "order": 2,
      "output_bytes_cap": 1048576,
      "provider": "codex",
      "run_id": "run-002-8febe3786dc60c0e",
      "timeout_seconds": 3600.0
    },
    {
      "block_id": "c0-sol-max-deep-coverage",
      "case_id": "F08-L-MDJSON-001",
      "effort": "max",
      "evaluator_timeout_seconds": 300.0,
      "model": "gpt-5.6-sol",
      "order": 3,
      "output_bytes_cap": 1048576,
      "provider": "codex",
      "run_id": "run-003-49afd61bc454adc9",
      "timeout_seconds": 3600.0
    },
    {
      "block_id": "c0-sol-max-deep-coverage",
      "case_id": "F09-L-PYBASHDOCKER-001",
      "effort": "max",
      "evaluator_timeout_seconds": 300.0,
      "model": "gpt-5.6-sol",
      "order": 4,
      "output_bytes_cap": 1048576,
      "provider": "codex",
      "run_id": "run-004-5f81d658366f99c7",
      "timeout_seconds": 3600.0
    }
  ],
  "purpose": "finite explicit C0 observations; repeat=1; rotation-seed=30; no routing recommendation or default winner",
  "safety": {
    "automatic_retry": false,
    "concurrency": 1,
    "continue_after_quality_fail": true,
    "deadline_seconds": 21600.0,
    "max_runs": 4
  },
  "schema_version": 1,
  "study_id": "duration-atlas-wave5-depth"
}
