{
  "batch_id": "wave7-c0-claude-medium-family12",
  "catalog_digest": "sha256:c89c127d5b02d0e72989508f6a7d7c0b9d1ed828ca61aa616db41ad90cb0f7d0",
  "created_at": "2026-08-27T12:00:00.000Z",
  "entries": [
    {
      "block_id": "wave7-c0-claude-medium-family12",
      "case_id": "F11-M-BASH-001",
      "effort": "medium",
      "evaluator_timeout_seconds": 300.0,
      "model": "opus",
      "order": 1,
      "output_bytes_cap": 1048576,
      "provider": "claude",
      "run_id": "run-001-9d91bd4b30b21b64",
      "timeout_seconds": 1800.0
    },
    {
      "block_id": "wave7-c0-claude-medium-family12",
      "case_id": "F09-L-PYBASHDOCKER-001",
      "effort": "medium",
      "evaluator_timeout_seconds": 300.0,
      "model": "opus",
      "order": 2,
      "output_bytes_cap": 1048576,
      "provider": "claude",
      "run_id": "run-002-b9a2fe59847cd1b8",
      "timeout_seconds": 1800.0
    },
    {
      "block_id": "wave7-c0-claude-medium-family12",
      "case_id": "F01-S-PY-001",
      "effort": "medium",
      "evaluator_timeout_seconds": 300.0,
      "model": "opus",
      "order": 3,
      "output_bytes_cap": 1048576,
      "provider": "claude",
      "run_id": "run-003-7552c49366c35e8f",
      "timeout_seconds": 1800.0
    },
    {
      "block_id": "wave7-c0-claude-medium-family12",
      "case_id": "F02-M-PY-001",
      "effort": "medium",
      "evaluator_timeout_seconds": 300.0,
      "model": "opus",
      "order": 4,
      "output_bytes_cap": 1048576,
      "provider": "claude",
      "run_id": "run-004-5d1854aec3d0328e",
      "timeout_seconds": 1800.0
    },
    {
      "block_id": "wave7-c0-claude-medium-family12",
      "case_id": "F12-L-MDJSON-001",
      "effort": "medium",
      "evaluator_timeout_seconds": 300.0,
      "model": "opus",
      "order": 5,
      "output_bytes_cap": 1048576,
      "provider": "claude",
      "run_id": "run-005-24bdc1664a361883",
      "timeout_seconds": 1800.0
    },
    {
      "block_id": "wave7-c0-claude-medium-family12",
      "case_id": "F07-S-MD-001",
      "effort": "medium",
      "evaluator_timeout_seconds": 300.0,
      "model": "opus",
      "order": 6,
      "output_bytes_cap": 1048576,
      "provider": "claude",
      "run_id": "run-006-0bc9784e548e0e38",
      "timeout_seconds": 1800.0
    },
    {
      "block_id": "wave7-c0-claude-medium-family12",
      "case_id": "F05-M-PY-001",
      "effort": "medium",
      "evaluator_timeout_seconds": 300.0,
      "model": "opus",
      "order": 7,
      "output_bytes_cap": 1048576,
      "provider": "claude",
      "run_id": "run-007-970e45b9fb5e494e",
      "timeout_seconds": 1800.0
    },
    {
      "block_id": "wave7-c0-claude-medium-family12",
      "case_id": "F06-L-PYBASH-001",
      "effort": "medium",
      "evaluator_timeout_seconds": 300.0,
      "model": "opus",
      "order": 8,
      "output_bytes_cap": 1048576,
      "provider": "claude",
      "run_id": "run-008-f564756c7affeffc",
      "timeout_seconds": 1800.0
    },
    {
      "block_id": "wave7-c0-claude-medium-family12",
      "case_id": "F10-S-PY-001",
      "effort": "medium",
      "evaluator_timeout_seconds": 300.0,
      "model": "opus",
      "order": 9,
      "output_bytes_cap": 1048576,
      "provider": "claude",
      "run_id": "run-009-db89771bc3c6d530",
      "timeout_seconds": 1800.0
    },
    {
      "block_id": "wave7-c0-claude-medium-family12",
      "case_id": "F08-M-MDJSON-001",
      "effort": "medium",
      "evaluator_timeout_seconds": 300.0,
      "model": "opus",
      "order": 10,
      "output_bytes_cap": 1048576,
      "provider": "claude",
      "run_id": "run-010-ee27dd99747cc2dd",
      "timeout_seconds": 1800.0
    },
    {
      "block_id": "wave7-c0-claude-medium-family12",
      "case_id": "F03-L-PYBASH-001",
      "effort": "medium",
      "evaluator_timeout_seconds": 300.0,
      "model": "opus",
      "order": 11,
      "output_bytes_cap": 1048576,
      "provider": "claude",
      "run_id": "run-011-bd8e92db93be267b",
      "timeout_seconds": 1800.0
    },
    {
      "block_id": "wave7-c0-claude-medium-family12",
      "case_id": "F04-S-PY-001",
      "effort": "medium",
      "evaluator_timeout_seconds": 300.0,
      "model": "opus",
      "order": 12,
      "output_bytes_cap": 1048576,
      "provider": "claude",
      "run_id": "run-012-f3ca7259edc9b455",
      "timeout_seconds": 1800.0
    }
  ],
  "purpose": "finite explicit C0 observations; repeat=1; rotation-seed=61; no routing recommendation or default winner",
  "safety": {
    "automatic_retry": false,
    "concurrency": 1,
    "continue_after_quality_fail": true,
    "deadline_seconds": 43200.0,
    "max_runs": 12
  },
  "schema_version": 1,
  "study_id": "duration-atlas-wave7-provider"
}
