{
  "batch_id": "wave8c-c0-sol-f06-threshold",
  "catalog_digest": "sha256:5bb6fff200412df126eb08fe0f7df63f71b8910085e62653aa3482d197b2cc8b",
  "created_at": "2026-08-27T17:40:00.000Z",
  "entries": [
    {
      "block_id": "wave8c-c0-sol-f06-threshold",
      "case_id": "F06-L-PYBASH-001",
      "effort": "medium",
      "evaluator_timeout_seconds": 180.0,
      "model": "gpt-5.6-sol",
      "order": 1,
      "output_bytes_cap": 8388608,
      "provider": "codex",
      "run_id": "run-001-1c21f9bacaa82ad4",
      "timeout_seconds": 1200.0
    },
    {
      "block_id": "wave8c-c0-sol-f06-threshold",
      "case_id": "F06-L-PYBASH-001",
      "effort": "high",
      "evaluator_timeout_seconds": 180.0,
      "model": "gpt-5.6-sol",
      "order": 2,
      "output_bytes_cap": 8388608,
      "provider": "codex",
      "run_id": "run-002-ab2f1ac12b8c70fe",
      "timeout_seconds": 1200.0
    },
    {
      "block_id": "wave8c-c0-sol-f06-threshold",
      "case_id": "F06-L-PYBASH-001",
      "effort": "high",
      "evaluator_timeout_seconds": 180.0,
      "model": "gpt-5.6-sol",
      "order": 3,
      "output_bytes_cap": 8388608,
      "provider": "codex",
      "run_id": "run-003-25f677a990680388",
      "timeout_seconds": 1200.0
    },
    {
      "block_id": "wave8c-c0-sol-f06-threshold",
      "case_id": "F06-L-PYBASH-001",
      "effort": "medium",
      "evaluator_timeout_seconds": 180.0,
      "model": "gpt-5.6-sol",
      "order": 4,
      "output_bytes_cap": 8388608,
      "provider": "codex",
      "run_id": "run-004-83787fa5b2dcb8ba",
      "timeout_seconds": 1200.0
    },
    {
      "block_id": "wave8c-c0-sol-f06-threshold",
      "case_id": "F06-L-PYBASH-001",
      "effort": "medium",
      "evaluator_timeout_seconds": 180.0,
      "model": "gpt-5.6-sol",
      "order": 5,
      "output_bytes_cap": 8388608,
      "provider": "codex",
      "run_id": "run-005-d7b76cd95d9efa9a",
      "timeout_seconds": 1200.0
    },
    {
      "block_id": "wave8c-c0-sol-f06-threshold",
      "case_id": "F06-L-PYBASH-001",
      "effort": "high",
      "evaluator_timeout_seconds": 180.0,
      "model": "gpt-5.6-sol",
      "order": 6,
      "output_bytes_cap": 8388608,
      "provider": "codex",
      "run_id": "run-006-db17cebd81f41681",
      "timeout_seconds": 1200.0
    }
  ],
  "purpose": "finite explicit C0 observations; repeat=3; rotation-seed=20260828; no routing recommendation or default winner",
  "safety": {
    "artifact_retention": "task-artifacts",
    "automatic_retry": false,
    "concurrency": 1,
    "continue_after_quality_fail": true,
    "deadline_seconds": 10800.0,
    "max_runs": 6
  },
  "schema_version": 1,
  "study_id": "duration-atlas-wave8-identifiable"
}
