{
  "batch_id": "wave4-recovery-c0-sol-medium-f09s",
  "catalog_digest": "sha256:c89c127d5b02d0e72989508f6a7d7c0b9d1ed828ca61aa616db41ad90cb0f7d0",
  "created_at": "2026-08-27T03:17:38Z",
  "entries": [
    {
      "block_id": "c0-sol-medium-infrastructure-recovery",
      "case_id": "F09-S-PY-001",
      "effort": "medium",
      "evaluator_timeout_seconds": 300.0,
      "model": "gpt-5.6-sol",
      "order": 1,
      "output_bytes_cap": 1048576,
      "provider": "codex",
      "run_id": "run-001-40ab8393969ce705",
      "timeout_seconds": 1800.0
    }
  ],
  "purpose": "finite explicit C0 observations; repeat=1; rotation-seed=41; no routing recommendation or default winner",
  "safety": {
    "automatic_retry": false,
    "concurrency": 1,
    "continue_after_quality_fail": true,
    "deadline_seconds": 3600.0,
    "max_runs": 1
  },
  "schema_version": 1,
  "study_id": "duration-atlas-wave4-recovery"
}
