{
  "batch_id": "wave8c-c0-sol-f12-r3-depth",
  "catalog_digest": "sha256:5bb6fff200412df126eb08fe0f7df63f71b8910085e62653aa3482d197b2cc8b",
  "created_at": "2026-08-27T17:40:00.000Z",
  "entries": [
    {
      "block_id": "wave8c-c0-sol-f12-r3-depth",
      "case_id": "F12-L-MDJSON-001",
      "effort": "medium",
      "evaluator_timeout_seconds": 120.0,
      "model": "gpt-5.6-sol",
      "order": 1,
      "output_bytes_cap": 8388608,
      "provider": "codex",
      "run_id": "run-001-13c36bb9696a1d71",
      "timeout_seconds": 1200.0
    },
    {
      "block_id": "wave8c-c0-sol-f12-r3-depth",
      "case_id": "F12-L-MDJSON-001",
      "effort": "high",
      "evaluator_timeout_seconds": 120.0,
      "model": "gpt-5.6-sol",
      "order": 2,
      "output_bytes_cap": 8388608,
      "provider": "codex",
      "run_id": "run-002-d3cf9d79254a7061",
      "timeout_seconds": 1200.0
    },
    {
      "block_id": "wave8c-c0-sol-f12-r3-depth",
      "case_id": "F12-L-MDJSON-001",
      "effort": "xhigh",
      "evaluator_timeout_seconds": 120.0,
      "model": "gpt-5.6-sol",
      "order": 3,
      "output_bytes_cap": 8388608,
      "provider": "codex",
      "run_id": "run-003-70850e7466251299",
      "timeout_seconds": 1200.0
    },
    {
      "block_id": "wave8c-c0-sol-f12-r3-depth",
      "case_id": "F12-L-MDJSON-001",
      "effort": "max",
      "evaluator_timeout_seconds": 120.0,
      "model": "gpt-5.6-sol",
      "order": 4,
      "output_bytes_cap": 8388608,
      "provider": "codex",
      "run_id": "run-004-4c6dadea2f466de4",
      "timeout_seconds": 1200.0
    },
    {
      "block_id": "wave8c-c0-sol-f12-r3-depth",
      "case_id": "F12-L-MDJSON-001",
      "effort": "high",
      "evaluator_timeout_seconds": 120.0,
      "model": "gpt-5.6-sol",
      "order": 5,
      "output_bytes_cap": 8388608,
      "provider": "codex",
      "run_id": "run-005-f3605a682aaf02cd",
      "timeout_seconds": 1200.0
    },
    {
      "block_id": "wave8c-c0-sol-f12-r3-depth",
      "case_id": "F12-L-MDJSON-001",
      "effort": "xhigh",
      "evaluator_timeout_seconds": 120.0,
      "model": "gpt-5.6-sol",
      "order": 6,
      "output_bytes_cap": 8388608,
      "provider": "codex",
      "run_id": "run-006-0fe8e9d9f10d163f",
      "timeout_seconds": 1200.0
    },
    {
      "block_id": "wave8c-c0-sol-f12-r3-depth",
      "case_id": "F12-L-MDJSON-001",
      "effort": "max",
      "evaluator_timeout_seconds": 120.0,
      "model": "gpt-5.6-sol",
      "order": 7,
      "output_bytes_cap": 8388608,
      "provider": "codex",
      "run_id": "run-007-cf2a699bb8216b28",
      "timeout_seconds": 1200.0
    },
    {
      "block_id": "wave8c-c0-sol-f12-r3-depth",
      "case_id": "F12-L-MDJSON-001",
      "effort": "medium",
      "evaluator_timeout_seconds": 120.0,
      "model": "gpt-5.6-sol",
      "order": 8,
      "output_bytes_cap": 8388608,
      "provider": "codex",
      "run_id": "run-008-44a93873c2c1304c",
      "timeout_seconds": 1200.0
    }
  ],
  "purpose": "finite explicit C0 observations; repeat=2; rotation-seed=20260828; no routing recommendation or default winner",
  "safety": {
    "artifact_retention": "task-artifacts",
    "automatic_retry": false,
    "concurrency": 1,
    "continue_after_quality_fail": true,
    "deadline_seconds": 14400.0,
    "max_runs": 8
  },
  "schema_version": 1,
  "study_id": "duration-atlas-wave8-identifiable"
}
