{
  "batch_id": "wave8-c0-sol-f10-contract",
  "catalog_digest": "sha256:c3c386e697885b96ce20571628e1923b27498db720afd34605a4931c47a3ff59",
  "created_at": "2026-08-27T16:42:00.397Z",
  "entries": [
    {
      "block_id": "wave8-c0-sol-f10-contract",
      "case_id": "F10-S-PY-001",
      "effort": "medium",
      "evaluator_timeout_seconds": 60.0,
      "model": "gpt-5.6-sol",
      "order": 1,
      "output_bytes_cap": 8388608,
      "provider": "codex",
      "run_id": "run-001-d7eb4c64accf26dc",
      "timeout_seconds": 600.0
    },
    {
      "block_id": "wave8-c0-sol-f10-contract",
      "case_id": "F10-S-PY-001",
      "effort": "high",
      "evaluator_timeout_seconds": 60.0,
      "model": "gpt-5.6-sol",
      "order": 2,
      "output_bytes_cap": 8388608,
      "provider": "codex",
      "run_id": "run-002-050fc9ca6f54aeeb",
      "timeout_seconds": 600.0
    },
    {
      "block_id": "wave8-c0-sol-f10-contract",
      "case_id": "F10-S-PY-001",
      "effort": "high",
      "evaluator_timeout_seconds": 60.0,
      "model": "gpt-5.6-sol",
      "order": 3,
      "output_bytes_cap": 8388608,
      "provider": "codex",
      "run_id": "run-003-3f32e92efa20a20b",
      "timeout_seconds": 600.0
    },
    {
      "block_id": "wave8-c0-sol-f10-contract",
      "case_id": "F10-S-PY-001",
      "effort": "medium",
      "evaluator_timeout_seconds": 60.0,
      "model": "gpt-5.6-sol",
      "order": 4,
      "output_bytes_cap": 8388608,
      "provider": "codex",
      "run_id": "run-004-a2047712e21e5aab",
      "timeout_seconds": 600.0
    }
  ],
  "purpose": "finite explicit C0 observations; repeat=2; rotation-seed=20260828; no routing recommendation or default winner",
  "safety": {
    "artifact_retention": "task-artifacts",
    "automatic_retry": false,
    "concurrency": 1,
    "continue_after_quality_fail": true,
    "deadline_seconds": 3600.0,
    "max_runs": 4
  },
  "schema_version": 1,
  "study_id": "duration-atlas-wave8-identifiable"
}
