{
  "batch_id": "wave6-c0-grok-medium-family12",
  "catalog_digest": "sha256:c89c127d5b02d0e72989508f6a7d7c0b9d1ed828ca61aa616db41ad90cb0f7d0",
  "created_at": "2026-08-27T12:00:00.000Z",
  "entries": [
    {
      "block_id": "wave6-c0-grok-medium-family12",
      "case_id": "F11-M-BASH-001",
      "effort": "medium",
      "evaluator_timeout_seconds": 300.0,
      "model": "grok-4.6",
      "order": 1,
      "output_bytes_cap": 1048576,
      "provider": "grok",
      "run_id": "run-001-553053b48f6fd867",
      "timeout_seconds": 1800.0
    },
    {
      "block_id": "wave6-c0-grok-medium-family12",
      "case_id": "F09-L-PYBASHDOCKER-001",
      "effort": "medium",
      "evaluator_timeout_seconds": 300.0,
      "model": "grok-4.6",
      "order": 2,
      "output_bytes_cap": 1048576,
      "provider": "grok",
      "run_id": "run-002-a43af54d4188cd09",
      "timeout_seconds": 1800.0
    },
    {
      "block_id": "wave6-c0-grok-medium-family12",
      "case_id": "F01-S-PY-001",
      "effort": "medium",
      "evaluator_timeout_seconds": 300.0,
      "model": "grok-4.6",
      "order": 3,
      "output_bytes_cap": 1048576,
      "provider": "grok",
      "run_id": "run-003-e4e5f8e76cc855cb",
      "timeout_seconds": 1800.0
    },
    {
      "block_id": "wave6-c0-grok-medium-family12",
      "case_id": "F02-M-PY-001",
      "effort": "medium",
      "evaluator_timeout_seconds": 300.0,
      "model": "grok-4.6",
      "order": 4,
      "output_bytes_cap": 1048576,
      "provider": "grok",
      "run_id": "run-004-6090cc0ecbc71b38",
      "timeout_seconds": 1800.0
    },
    {
      "block_id": "wave6-c0-grok-medium-family12",
      "case_id": "F12-L-MDJSON-001",
      "effort": "medium",
      "evaluator_timeout_seconds": 300.0,
      "model": "grok-4.6",
      "order": 5,
      "output_bytes_cap": 1048576,
      "provider": "grok",
      "run_id": "run-005-02d98291e743f9fc",
      "timeout_seconds": 1800.0
    },
    {
      "block_id": "wave6-c0-grok-medium-family12",
      "case_id": "F07-S-MD-001",
      "effort": "medium",
      "evaluator_timeout_seconds": 300.0,
      "model": "grok-4.6",
      "order": 6,
      "output_bytes_cap": 1048576,
      "provider": "grok",
      "run_id": "run-006-b36e517437e66ec9",
      "timeout_seconds": 1800.0
    },
    {
      "block_id": "wave6-c0-grok-medium-family12",
      "case_id": "F05-M-PY-001",
      "effort": "medium",
      "evaluator_timeout_seconds": 300.0,
      "model": "grok-4.6",
      "order": 7,
      "output_bytes_cap": 1048576,
      "provider": "grok",
      "run_id": "run-007-5ef5a801077ce49c",
      "timeout_seconds": 1800.0
    },
    {
      "block_id": "wave6-c0-grok-medium-family12",
      "case_id": "F06-L-PYBASH-001",
      "effort": "medium",
      "evaluator_timeout_seconds": 300.0,
      "model": "grok-4.6",
      "order": 8,
      "output_bytes_cap": 1048576,
      "provider": "grok",
      "run_id": "run-008-9d2df08335c0b277",
      "timeout_seconds": 1800.0
    },
    {
      "block_id": "wave6-c0-grok-medium-family12",
      "case_id": "F10-S-PY-001",
      "effort": "medium",
      "evaluator_timeout_seconds": 300.0,
      "model": "grok-4.6",
      "order": 9,
      "output_bytes_cap": 1048576,
      "provider": "grok",
      "run_id": "run-009-2bb14915b664e5af",
      "timeout_seconds": 1800.0
    },
    {
      "block_id": "wave6-c0-grok-medium-family12",
      "case_id": "F08-M-MDJSON-001",
      "effort": "medium",
      "evaluator_timeout_seconds": 300.0,
      "model": "grok-4.6",
      "order": 10,
      "output_bytes_cap": 1048576,
      "provider": "grok",
      "run_id": "run-010-3339588d55d9be29",
      "timeout_seconds": 1800.0
    },
    {
      "block_id": "wave6-c0-grok-medium-family12",
      "case_id": "F03-L-PYBASH-001",
      "effort": "medium",
      "evaluator_timeout_seconds": 300.0,
      "model": "grok-4.6",
      "order": 11,
      "output_bytes_cap": 1048576,
      "provider": "grok",
      "run_id": "run-011-16e30cd1a1c95aa0",
      "timeout_seconds": 1800.0
    },
    {
      "block_id": "wave6-c0-grok-medium-family12",
      "case_id": "F04-S-PY-001",
      "effort": "medium",
      "evaluator_timeout_seconds": 300.0,
      "model": "grok-4.6",
      "order": 12,
      "output_bytes_cap": 1048576,
      "provider": "grok",
      "run_id": "run-012-06ed7485f4107e51",
      "timeout_seconds": 1800.0
    }
  ],
  "purpose": "finite explicit C0 observations; repeat=1; rotation-seed=61; no routing recommendation or default winner",
  "safety": {
    "automatic_retry": false,
    "concurrency": 1,
    "continue_after_quality_fail": true,
    "deadline_seconds": 43200.0,
    "max_runs": 12
  },
  "schema_version": 1,
  "study_id": "duration-atlas-wave6-provider"
}
