{
  "batch_id": "wave8b-c0-grok-f12-r3-depth",
  "catalog_digest": "sha256:e4615beeb71c3e5a03f5175f515cb83d5e56166c9f1240d3eadbb61c0bb9d2d3",
  "created_at": "2026-08-27T17:20:00.000Z",
  "entries": [
    {
      "block_id": "wave8b-c0-grok-f12-r3-depth",
      "case_id": "F12-L-MDJSON-001",
      "effort": "high",
      "evaluator_timeout_seconds": 120.0,
      "model": "grok-4.6",
      "order": 1,
      "output_bytes_cap": 8388608,
      "provider": "grok",
      "run_id": "run-001-780ea9d50a605b5f",
      "timeout_seconds": 900.0
    },
    {
      "block_id": "wave8b-c0-grok-f12-r3-depth",
      "case_id": "F12-L-MDJSON-001",
      "effort": "xhigh",
      "evaluator_timeout_seconds": 120.0,
      "model": "grok-4.6",
      "order": 2,
      "output_bytes_cap": 8388608,
      "provider": "grok",
      "run_id": "run-002-9116c754290353c4",
      "timeout_seconds": 900.0
    },
    {
      "block_id": "wave8b-c0-grok-f12-r3-depth",
      "case_id": "F12-L-MDJSON-001",
      "effort": "medium",
      "evaluator_timeout_seconds": 120.0,
      "model": "grok-4.6",
      "order": 3,
      "output_bytes_cap": 8388608,
      "provider": "grok",
      "run_id": "run-003-21f4febf250584b3",
      "timeout_seconds": 900.0
    },
    {
      "block_id": "wave8b-c0-grok-f12-r3-depth",
      "case_id": "F12-L-MDJSON-001",
      "effort": "xhigh",
      "evaluator_timeout_seconds": 120.0,
      "model": "grok-4.6",
      "order": 4,
      "output_bytes_cap": 8388608,
      "provider": "grok",
      "run_id": "run-004-4f18e97971232192",
      "timeout_seconds": 900.0
    },
    {
      "block_id": "wave8b-c0-grok-f12-r3-depth",
      "case_id": "F12-L-MDJSON-001",
      "effort": "medium",
      "evaluator_timeout_seconds": 120.0,
      "model": "grok-4.6",
      "order": 5,
      "output_bytes_cap": 8388608,
      "provider": "grok",
      "run_id": "run-005-7d5a74a5c9f8bbe4",
      "timeout_seconds": 900.0
    },
    {
      "block_id": "wave8b-c0-grok-f12-r3-depth",
      "case_id": "F12-L-MDJSON-001",
      "effort": "high",
      "evaluator_timeout_seconds": 120.0,
      "model": "grok-4.6",
      "order": 6,
      "output_bytes_cap": 8388608,
      "provider": "grok",
      "run_id": "run-006-df57f12246794013",
      "timeout_seconds": 900.0
    }
  ],
  "purpose": "finite explicit C0 observations; repeat=2; rotation-seed=20260828; no routing recommendation or default winner",
  "safety": {
    "artifact_retention": "task-artifacts",
    "automatic_retry": false,
    "concurrency": 1,
    "continue_after_quality_fail": true,
    "deadline_seconds": 7200.0,
    "max_runs": 6
  },
  "schema_version": 1,
  "study_id": "duration-atlas-wave8-identifiable"
}
