{
  "batch_id": "wave6-c0-grok-xhigh-deep4",
  "catalog_digest": "sha256:c89c127d5b02d0e72989508f6a7d7c0b9d1ed828ca61aa616db41ad90cb0f7d0",
  "created_at": "2026-08-27T12:00:00.000Z",
  "entries": [
    {
      "block_id": "wave6-c0-grok-xhigh-deep4",
      "case_id": "F12-L-MDJSON-001",
      "effort": "xhigh",
      "evaluator_timeout_seconds": 300.0,
      "model": "grok-4.6",
      "order": 1,
      "output_bytes_cap": 1048576,
      "provider": "grok",
      "run_id": "run-001-9b3208f07e508e3a",
      "timeout_seconds": 1800.0
    },
    {
      "block_id": "wave6-c0-grok-xhigh-deep4",
      "case_id": "F09-L-PYBASHDOCKER-001",
      "effort": "xhigh",
      "evaluator_timeout_seconds": 300.0,
      "model": "grok-4.6",
      "order": 2,
      "output_bytes_cap": 1048576,
      "provider": "grok",
      "run_id": "run-002-e4d72e12f812a802",
      "timeout_seconds": 1800.0
    },
    {
      "block_id": "wave6-c0-grok-xhigh-deep4",
      "case_id": "F03-L-PYBASH-001",
      "effort": "xhigh",
      "evaluator_timeout_seconds": 300.0,
      "model": "grok-4.6",
      "order": 3,
      "output_bytes_cap": 1048576,
      "provider": "grok",
      "run_id": "run-003-361a0549df85bf5f",
      "timeout_seconds": 1800.0
    },
    {
      "block_id": "wave6-c0-grok-xhigh-deep4",
      "case_id": "F08-L-MDJSON-001",
      "effort": "xhigh",
      "evaluator_timeout_seconds": 300.0,
      "model": "grok-4.6",
      "order": 4,
      "output_bytes_cap": 1048576,
      "provider": "grok",
      "run_id": "run-004-a96094fecd70da84",
      "timeout_seconds": 1800.0
    }
  ],
  "purpose": "finite explicit C0 observations; repeat=1; rotation-seed=71; no routing recommendation or default winner",
  "safety": {
    "automatic_retry": false,
    "concurrency": 1,
    "continue_after_quality_fail": true,
    "deadline_seconds": 43200.0,
    "max_runs": 4
  },
  "schema_version": 1,
  "study_id": "duration-atlas-wave6-provider"
}
