{
  "batch_id": "wave8d-c0-grok-f10-r5-contract",
  "catalog_digest": "sha256:57955d2bc9471765fdc9338416b5acc5b02bb0302c208de95e474910994bd628",
  "created_at": "2026-08-27T18:00:00.000Z",
  "entries": [
    {
      "block_id": "wave8d-c0-grok-f10-r5-contract",
      "case_id": "F10-S-PY-001",
      "effort": "medium",
      "evaluator_timeout_seconds": 60.0,
      "model": "grok-4.6",
      "order": 1,
      "output_bytes_cap": 8388608,
      "provider": "grok",
      "run_id": "run-001-5472b0e0b76704d9",
      "timeout_seconds": 600.0
    },
    {
      "block_id": "wave8d-c0-grok-f10-r5-contract",
      "case_id": "F10-S-PY-001",
      "effort": "high",
      "evaluator_timeout_seconds": 60.0,
      "model": "grok-4.6",
      "order": 2,
      "output_bytes_cap": 8388608,
      "provider": "grok",
      "run_id": "run-002-eda1eebca3b8e737",
      "timeout_seconds": 600.0
    },
    {
      "block_id": "wave8d-c0-grok-f10-r5-contract",
      "case_id": "F10-S-PY-001",
      "effort": "high",
      "evaluator_timeout_seconds": 60.0,
      "model": "grok-4.6",
      "order": 3,
      "output_bytes_cap": 8388608,
      "provider": "grok",
      "run_id": "run-003-ed352b2adf57e920",
      "timeout_seconds": 600.0
    },
    {
      "block_id": "wave8d-c0-grok-f10-r5-contract",
      "case_id": "F10-S-PY-001",
      "effort": "medium",
      "evaluator_timeout_seconds": 60.0,
      "model": "grok-4.6",
      "order": 4,
      "output_bytes_cap": 8388608,
      "provider": "grok",
      "run_id": "run-004-a573e9efc0fa1db1",
      "timeout_seconds": 600.0
    }
  ],
  "purpose": "finite explicit C0 observations; repeat=2; rotation-seed=20260828; no routing recommendation or default winner",
  "safety": {
    "artifact_retention": "task-artifacts",
    "automatic_retry": false,
    "concurrency": 1,
    "continue_after_quality_fail": true,
    "deadline_seconds": 3600.0,
    "max_runs": 4
  },
  "schema_version": 1,
  "study_id": "duration-atlas-wave8-identifiable"
}
