{
  "batch_id": "wave8c-c0-grok-f10-r4-contract",
  "catalog_digest": "sha256:5bb6fff200412df126eb08fe0f7df63f71b8910085e62653aa3482d197b2cc8b",
  "created_at": "2026-08-27T17:40:00.000Z",
  "entries": [
    {
      "block_id": "wave8c-c0-grok-f10-r4-contract",
      "case_id": "F10-S-PY-001",
      "effort": "medium",
      "evaluator_timeout_seconds": 60.0,
      "model": "grok-4.6",
      "order": 1,
      "output_bytes_cap": 8388608,
      "provider": "grok",
      "run_id": "run-001-8acd5cb092ee5ff9",
      "timeout_seconds": 600.0
    },
    {
      "block_id": "wave8c-c0-grok-f10-r4-contract",
      "case_id": "F10-S-PY-001",
      "effort": "high",
      "evaluator_timeout_seconds": 60.0,
      "model": "grok-4.6",
      "order": 2,
      "output_bytes_cap": 8388608,
      "provider": "grok",
      "run_id": "run-002-d6bd42c19c119287",
      "timeout_seconds": 600.0
    },
    {
      "block_id": "wave8c-c0-grok-f10-r4-contract",
      "case_id": "F10-S-PY-001",
      "effort": "high",
      "evaluator_timeout_seconds": 60.0,
      "model": "grok-4.6",
      "order": 3,
      "output_bytes_cap": 8388608,
      "provider": "grok",
      "run_id": "run-003-02faaab7c8523609",
      "timeout_seconds": 600.0
    },
    {
      "block_id": "wave8c-c0-grok-f10-r4-contract",
      "case_id": "F10-S-PY-001",
      "effort": "medium",
      "evaluator_timeout_seconds": 60.0,
      "model": "grok-4.6",
      "order": 4,
      "output_bytes_cap": 8388608,
      "provider": "grok",
      "run_id": "run-004-d783d65cd21e820a",
      "timeout_seconds": 600.0
    }
  ],
  "purpose": "finite explicit C0 observations; repeat=2; rotation-seed=20260828; no routing recommendation or default winner",
  "safety": {
    "artifact_retention": "task-artifacts",
    "automatic_retry": false,
    "concurrency": 1,
    "continue_after_quality_fail": true,
    "deadline_seconds": 3600.0,
    "max_runs": 4
  },
  "schema_version": 1,
  "study_id": "duration-atlas-wave8-identifiable"
}
