{
  "batch_id": "wave8d-c0-grok-f12-r3-depth",
  "catalog_digest": "sha256:57955d2bc9471765fdc9338416b5acc5b02bb0302c208de95e474910994bd628",
  "created_at": "2026-08-27T18:00:00.000Z",
  "entries": [
    {
      "block_id": "wave8d-c0-grok-f12-r3-depth",
      "case_id": "F12-L-MDJSON-001",
      "effort": "high",
      "evaluator_timeout_seconds": 120.0,
      "model": "grok-4.6",
      "order": 1,
      "output_bytes_cap": 8388608,
      "provider": "grok",
      "run_id": "run-001-4c4bc45a6b467b27",
      "timeout_seconds": 900.0
    },
    {
      "block_id": "wave8d-c0-grok-f12-r3-depth",
      "case_id": "F12-L-MDJSON-001",
      "effort": "xhigh",
      "evaluator_timeout_seconds": 120.0,
      "model": "grok-4.6",
      "order": 2,
      "output_bytes_cap": 8388608,
      "provider": "grok",
      "run_id": "run-002-b151499f8b68fec9",
      "timeout_seconds": 900.0
    },
    {
      "block_id": "wave8d-c0-grok-f12-r3-depth",
      "case_id": "F12-L-MDJSON-001",
      "effort": "medium",
      "evaluator_timeout_seconds": 120.0,
      "model": "grok-4.6",
      "order": 3,
      "output_bytes_cap": 8388608,
      "provider": "grok",
      "run_id": "run-003-f83b27f18b944654",
      "timeout_seconds": 900.0
    },
    {
      "block_id": "wave8d-c0-grok-f12-r3-depth",
      "case_id": "F12-L-MDJSON-001",
      "effort": "xhigh",
      "evaluator_timeout_seconds": 120.0,
      "model": "grok-4.6",
      "order": 4,
      "output_bytes_cap": 8388608,
      "provider": "grok",
      "run_id": "run-004-00a80849e870702a",
      "timeout_seconds": 900.0
    },
    {
      "block_id": "wave8d-c0-grok-f12-r3-depth",
      "case_id": "F12-L-MDJSON-001",
      "effort": "medium",
      "evaluator_timeout_seconds": 120.0,
      "model": "grok-4.6",
      "order": 5,
      "output_bytes_cap": 8388608,
      "provider": "grok",
      "run_id": "run-005-edc6e9187140ec77",
      "timeout_seconds": 900.0
    },
    {
      "block_id": "wave8d-c0-grok-f12-r3-depth",
      "case_id": "F12-L-MDJSON-001",
      "effort": "high",
      "evaluator_timeout_seconds": 120.0,
      "model": "grok-4.6",
      "order": 6,
      "output_bytes_cap": 8388608,
      "provider": "grok",
      "run_id": "run-006-3418c9f56ea9f5f3",
      "timeout_seconds": 900.0
    }
  ],
  "purpose": "finite explicit C0 observations; repeat=2; rotation-seed=20260828; no routing recommendation or default winner",
  "safety": {
    "artifact_retention": "task-artifacts",
    "automatic_retry": false,
    "concurrency": 1,
    "continue_after_quality_fail": true,
    "deadline_seconds": 7200.0,
    "max_runs": 6
  },
  "schema_version": 1,
  "study_id": "duration-atlas-wave8-identifiable"
}
