{
  "batch_id": "wave8c-c0-grok-f12-r3-depth",
  "catalog_digest": "sha256:5bb6fff200412df126eb08fe0f7df63f71b8910085e62653aa3482d197b2cc8b",
  "created_at": "2026-08-27T17:40:00.000Z",
  "entries": [
    {
      "block_id": "wave8c-c0-grok-f12-r3-depth",
      "case_id": "F12-L-MDJSON-001",
      "effort": "high",
      "evaluator_timeout_seconds": 120.0,
      "model": "grok-4.6",
      "order": 1,
      "output_bytes_cap": 8388608,
      "provider": "grok",
      "run_id": "run-001-87e36d755b523dd5",
      "timeout_seconds": 900.0
    },
    {
      "block_id": "wave8c-c0-grok-f12-r3-depth",
      "case_id": "F12-L-MDJSON-001",
      "effort": "xhigh",
      "evaluator_timeout_seconds": 120.0,
      "model": "grok-4.6",
      "order": 2,
      "output_bytes_cap": 8388608,
      "provider": "grok",
      "run_id": "run-002-d2a2bff1eb6929cf",
      "timeout_seconds": 900.0
    },
    {
      "block_id": "wave8c-c0-grok-f12-r3-depth",
      "case_id": "F12-L-MDJSON-001",
      "effort": "medium",
      "evaluator_timeout_seconds": 120.0,
      "model": "grok-4.6",
      "order": 3,
      "output_bytes_cap": 8388608,
      "provider": "grok",
      "run_id": "run-003-06651a1567feb0e4",
      "timeout_seconds": 900.0
    },
    {
      "block_id": "wave8c-c0-grok-f12-r3-depth",
      "case_id": "F12-L-MDJSON-001",
      "effort": "xhigh",
      "evaluator_timeout_seconds": 120.0,
      "model": "grok-4.6",
      "order": 4,
      "output_bytes_cap": 8388608,
      "provider": "grok",
      "run_id": "run-004-d3d37370360f8e5c",
      "timeout_seconds": 900.0
    },
    {
      "block_id": "wave8c-c0-grok-f12-r3-depth",
      "case_id": "F12-L-MDJSON-001",
      "effort": "medium",
      "evaluator_timeout_seconds": 120.0,
      "model": "grok-4.6",
      "order": 5,
      "output_bytes_cap": 8388608,
      "provider": "grok",
      "run_id": "run-005-e98a4d48a7c9c6d2",
      "timeout_seconds": 900.0
    },
    {
      "block_id": "wave8c-c0-grok-f12-r3-depth",
      "case_id": "F12-L-MDJSON-001",
      "effort": "high",
      "evaluator_timeout_seconds": 120.0,
      "model": "grok-4.6",
      "order": 6,
      "output_bytes_cap": 8388608,
      "provider": "grok",
      "run_id": "run-006-1c6d51beb63d30e4",
      "timeout_seconds": 900.0
    }
  ],
  "purpose": "finite explicit C0 observations; repeat=2; rotation-seed=20260828; no routing recommendation or default winner",
  "safety": {
    "artifact_retention": "task-artifacts",
    "automatic_retry": false,
    "concurrency": 1,
    "continue_after_quality_fail": true,
    "deadline_seconds": 7200.0,
    "max_runs": 6
  },
  "schema_version": 1,
  "study_id": "duration-atlas-wave8-identifiable"
}
